<?xml version="1.0" encoding="UTF-8"?>
<devices xmlns:xsi="http://www.w3.org/2001/XMLSchema-instance"
         xmlns="http://www.example.com/devices"
         xsi:schemaLocation="http://www.example.com/devices ../schema/devices.xsd">

    <peripheral-device device-id="peripheral1" color="Blue">
        <name>Peripheral example</name>
        <origin>USA</origin>
        <price>100</price>
        <release-time>2020-12</release-time>
        <power-consumption>100</power-consumption>
        <cooler>false</cooler>
        <critical>true</critical>
        <port>USB</port>
        <peripheral-type>IO</peripheral-type>
    </peripheral-device>

    <peripheral-device device-id="peripheral2" color="Blue">
        <name>Peripheral example</name>
        <origin>USA</origin>
        <price>100</price>
        <release-time>2020-12</release-time>
        <power-consumption>100</power-consumption>
        <cooler>false</cooler>
        <critical>true</critical>
        <port>USB</port>
        <peripheral-type>IO</peripheral-type>
    </peripheral-device>

    <peripheral-device device-id="peripheral3" color="Blue">
        <name>Peripheral example</name>
        <origin>USA</origin>
        <price>100</price>
        <release-time>2020-12</release-time>
        <power-consumption>100</power-consumption>
        <cooler>false</cooler>
        <critical>true</critical>
        <port>USB</port>
        <peripheral-type>IO</peripheral-type>
    </peripheral-device>

    <peripheral-device device-id="peripheral4" color="Blue">
        <name>Peripheral example</name>
        <origin>USA</origin>
        <price>100</price>
        <release-time>2020-12</release-time>
        <power-consumption>100</power-consumption>
        <cooler>false</cooler>
        <critical>true</critical>
        <port>USB</port>
        <peripheral-type>IO</peripheral-type>
    </peripheral-device>

    <peripheral-device device-id="peripheral5" color="Blue">
        <name>Peripheral example</name>
        <origin>USA</origin>
        <price>100</price>
        <release-time>2020-12</release-time>
        <power-consumption>100</power-consumption>
        <cooler>false</cooler>
        <critical>true</critical>
        <port>USB</port>
        <peripheral-type>IO</peripheral-type>
    </peripheral-device>

    <peripheral-device device-id="peripheral6" color="Blue">
        <name>Peripheral example</name>
        <origin>USA</origin>
        <price>100</price>
        <release-time>2020-12</release-time>
        <power-consumption>100</power-consumption>
        <cooler>false</cooler>
        <critical>true</critical>
        <port>USB</port>
        <peripheral-type>IO</peripheral-type>
    </peripheral-device>

    <peripheral-device device-id="peripheral7" color="Blue">
        <name>Peripheral example</name>
        <origin>USA</origin>
        <price>100</price>
        <release-time>2020-12</release-time>
        <power-consumption>100</power-consumption>
        <cooler>false</cooler>
        <critical>true</critical>
        <port>USB</port>
        <peripheral-type>IO</peripheral-type>
    </peripheral-device>

    <peripheral-device device-id="peripheral8" color="Blue">
        <name>Peripheral example</name>
        <origin>USA</origin>
        <price>100</price>
        <release-time>2020-12</release-time>
        <power-consumption>100</power-consumption>
        <cooler>false</cooler>
        <critical>true</critical>
        <port>USB</port>
        <peripheral-type>IO</peripheral-type>
    </peripheral-device>

    <integral-device device-id="integral1">
        <name>Integral example</name>
        <origin>CHINA</origin>
        <price>1000</price>
        <release-time>2016-11</release-time>
        <power-consumption>1000</power-consumption>
        <cooler>true</cooler>
        <critical>true</critical>
        <integral-type>CPU</integral-type>
    </integral-device>

    <integral-device device-id="integral2">
        <name>Integral example</name>
        <origin>CHINA</origin>
        <price>1000</price>
        <release-time>2016-11</release-time>
        <power-consumption>1000</power-consumption>
        <cooler>true</cooler>
        <critical>true</critical>
        <integral-type>CPU</integral-type>
    </integral-device>

    <integral-device device-id="integral3">
        <name>Integral example</name>
        <origin>CHINA</origin>
        <price>1000</price>
        <release-time>2016-11</release-time>
        <power-consumption>1000</power-consumption>
        <cooler>true</cooler>
        <critical>true</critical>
        <integral-type>CPU</integral-type>
    </integral-device>

    <integral-device device-id="integral4">
        <name>Integral example</name>
        <origin>CHINA</origin>
        <price>1000</price>
        <release-time>2016-11</release-time>
        <power-consumption>1000</power-consumption>
        <cooler>true</cooler>
        <critical>true</critical>
        <integral-type>CPU</integral-type>
    </integral-device>

    <integral-device device-id="integral5">
        <name>Integral example</name>
        <origin>CHINA</origin>
        <price>1000</price>
        <release-time>2016-11</release-time>
        <power-consumption>1000</power-consumption>
        <cooler>true</cooler>
        <critical>true</critical>
        <integral-type>CPU</integral-type>
    </integral-device>

    <integral-device device-id="integral6">
        <name>Integral example</name>
        <origin>CHINA</origin>
        <price>1000</price>
        <release-time>2016-11</release-time>
        <power-consumption>1000</power-consumption>
        <cooler>true</cooler>
        <critical>true</critical>
        <integral-type>CPU</integral-type>
    </integral-device>

    <integral-device device-id="integral7">
        <name>Integral example</name>
        <origin>CHINA</origin>
        <price>1000</price>
        <release-time>2016-11</release-time>
        <power-consumption>1000</power-consumption>
        <cooler>true</cooler>
        <critical>true</critical>
        <integral-type>CPU</integral-type>
    </integral-device>

    <integral-device device-id="integral8">
        <name>Integral example</name>
        <origin>CHINA</origin>
        <price>1000</price>
        <release-time>2016-11</release-time>
        <power-consumption>1000</power-consumption>
        <cooler>true</cooler>
        <critical>true</critical>
        <integral-type>CPU</integral-type>
    </integral-device>

</devices>